question,answer,university
কেউ কি ইংরেজি তে মাইনাস আর বাংলায় মাইনাস পাইলে চুয়েটে দিতে পারবে??,চোখ রাখুন https://www.admissionwar.com/ এবং সার্চ করুন চুয়েট অথবা চেক করুন https://www.cuet.ac.bd/admission গিয়ে এডমিশন সেকশনে সার্চ করুন,CUET
চুয়েটে আবেদনের পর পরীক্ষা দিতে পারব কি না সেইটা কখন জানা যাবে?,সিলেকশন লিস্ট দিয়ে দিবে সবসময় চোখ রাখবে,CUET
চুয়েটে নো সেকেন্ড টাইম?,না সেকেন্ড টাইম নেই,CUET
চুয়েটে কি সেকেন্ড টাইম আছে?,না সেকেন্ড টাইম নেই,CUET
ভাইয়া ক্যালকুলেটরের পিছনের অংশ কি খুলে রেখে দিবে...? ওখানে এটা চার্ট থাকে যে,রেখে দিতে পারে,CUET
চুয়েটে প্রশ্নের সেট আলাদা হবে??? আর হলে কয়টা সেট হবে????,আলাদা হবে নির্দিষ্ট কোনো সংখ্যা নেই,CUET
চুয়েটে আবেদন এর যোগ্যতা বলবেন প্লিজ?,চোখ রাখুন https://www.admissionwar.com/ এবং সার্চ করুন চুয়েট অথবা চেক করুন https://www.cuet.ac.bd/admission গিয়ে এডমিশন সেকশনে সার্চ করুন,CUET
চুয়েটে এইবার পুরোটা এমসিকিউ?,হুম এমসিকিউ হয় তাও বিস্তারিত জানতে চোখ রাখুন https://www.admissionwar.com/ এবং সার্চ করুন চুয়েট অথবা চেক করুন https://www.cuet.ac.bd/admission গিয়ে এডমিশন সেকশনে সার্চ করুন,CUET
ফিজিক্স আর কেমিস্ট্রি তে প্লাস মিস। চুয়েটে এক্সাম দিতে পারব?,চোখ রাখুন https://www.admissionwar.com/ এবং সার্চ করুন চুয়েট অথবা চেক করুন https://www.cuet.ac.bd/admission গিয়ে এডমিশন সেকশনে সার্চ করুন,CUET
আমি মাদ্রাসার মানবিক বিভাগের ছাত্র। আমি কি চুয়েটে এক্সাম দিতে পারব?,হুম পারবে যদি তুমি রিকোয়ারমেন্ট ফিলাপ করতে পার,CUET
আমার এসএসসি আর এইচএসসি মিলে কত পয়েন্ট পেলে চুয়েটে এপ্লাই করতে পারব?,চোখ রাখুন https://www.admissionwar.com/ এবং সার্চ করুন চুয়েট অথবা চেক করুন https://www.cuet.ac.bd/admission গিয়ে এডমিশন সেকশনে সার্চ করুন,CUET
যাদের ১৮ তারা কি চুয়েটে এক্সাম দিতে পারবে?,চোখ রাখুন https://www.admissionwar.com/ এবং সার্চ করুন চুয়েট অথবা চেক করুন https://www.cuet.ac.bd/admission গিয়ে এডমিশন সেকশনে সার্চ করুন,CUET
আমার কেমিস্ট্রি তে প্লাস মিস আমি কি চুয়েটে এক্সাম দিতে পারব?,চোখ রাখুন https://www.admissionwar.com/ এবং সার্চ করুন চুয়েট অথবা চেক করুন https://www.cuet.ac.bd/admission গিয়ে এডমিশন সেকশনে সার্চ করুন,CUET
আমার বাংলায় প্লাস মিস আমি কি চুয়েটে এক্সাম দিতে পারব?,চোখ রাখুন https://www.admissionwar.com/ এবং সার্চ করুন চুয়েট অথবা চেক করুন https://www.cuet.ac.bd/admission গিয়ে এডমিশন সেকশনে সার্চ করুন,CUET
আমার ১৮ ইংরেজি আর ফিজিক্সে প্লাস মিস। আমি কি চুয়েটে এক্সাম দিতে পারব?,চোখ রাখুন https://www.admissionwar.com/ এবং সার্চ করুন চুয়েট অথবা চেক করুন https://www.cuet.ac.bd/admission গিয়ে এডমিশন সেকশনে সার্চ করুন,CUET
চুয়েটের এক্সামের মানবন্টন টা কি?,চোখ রাখুন https://www.admissionwar.com/ এবং সার্চ করুন চুয়েট অথবা চেক করুন https://www.cuet.ac.bd/admission গিয়ে এডমিশন সেকশনে সার্চ করুন,CUET
১৯ দের কি আশা আছে চুয়েটে?,চোখ রাখুন https://www.admissionwar.com/ এবং সার্চ করুন চুয়েট অথবা চেক করুন https://www.cuet.ac.bd/admission গিয়ে এডমিশন সেকশনে সার্চ করুন,CUET
চুয়েটে প্রশ্নের টাইপ কি এমসিকিউ নাকি লিখিত?,এমসিকিউ,CUET
চুয়েটে কি টাইপের ক্যাল্কুলেটর ইউজ করা যাবে?,মোটামুটি এমএস সিরিজের সব ক্যাল্কুলেটর ইউজ করা যাবে তাও বিস্তারিত জানতে চোখ রাখুন https://www.admissionwar.com/ এবং সার্চ করুন চুয়েট অথবা চেক করুন https://www.cuet.ac.bd/admission গিয়ে এডমিশন সেকশনে সার্চ করুন,CUET
আমার ফিজিক্স এবং ইংরেজিতে প্লাস মিস। আমি কি চুয়েটে এক্সাম দিতে পারব?,চোখ রাখুন https://www.admissionwar.com/ এবং সার্চ করুন চুয়েট অথবা চেক করুন https://www.cuet.ac.bd/admission গিয়ে এডমিশন সেকশনে সার্চ করুন,CUET
চুয়েটের কোন কোন সাবজেক্ট আইইবি এপ্রোভড?,Check this http://www.iebbd.org/page/default.aspx?contentid=117&fbclid=IwAR3ObgJyJb5tCQ1r8q5BeiMKMHIg3pze24DkSHNFbnZ2KFzHGimuBcrzoiI,CUET
ইংরেজি+গণিত+পদার্থ+রসায়ন মিলে ১৭.৫ হলে কি রুয়েটে এক্সাম  দেওয়া যাবে?,একেক বছর একেক রিকোয়ারমেন্ট লাগে চেক https://www.admissionwar.com/ এবং সার্চ করুন চুয়েট অথবা চেক করুন http://www.ruet.ac.bd/admission/ গিয়ে এডমিশন সেকশনে সার্চ করুন,RUET
ইংরেজি+গণিত+পদার্থ+রসায়ন মিলে 19 হলে কি রুয়েটে এক্সাম দেওয়া যাবে? আমার GPA 5 আসে নাই।,একেক বছর একেক রিকোয়ারমেন্ট লাগে চেক https://www.admissionwar.com/ এবং সার্চ করুন চুয়েট অথবা চেক করুন http://www.ruet.ac.bd/admission/ গিয়ে এডমিশন সেকশনে সার্চ করুন,RUET
ভাই রুয়েট ইন্জিনিয়ারিংয়ে কি সেকেন্ড টাইম আছে ?,না নেই,RUET
এসএসসি এবং এইচএসসি তে কেমন রেজাল্ট লাগবে রুয়েটে ভর্তি হতে হলে?,একেক বছর একেক রিকোয়ারমেন্ট লাগে চেক https://www.admissionwar.com/ এবং সার্চ করুন চুয়েট অথবা চেক করুন http://www.ruet.ac.bd/admission/ গিয়ে এডমিশন সেকশনে সার্চ করুন,RUET
রুয়েটের কোন কোন সাবজেক্ট আইইবি এপ্রোভড?,Check this http://www.iebbd.org/page/default.aspx?contentid=117&fbclid=IwAR3ObgJyJb5tCQ1r8q5BeiMKMHIg3pze24DkSHNFbnZ2KFzHGimuBcrzoiI,RUET
ফর্ম তোলার নূন্যতম যোগ্যতা কত রুয়েটে?,একেক বছর একেক রিকোয়ারমেন্ট লাগে চেক https://www.admissionwar.com/ এবং সার্চ করুন চুয়েট অথবা চেক করুন http://www.ruet.ac.bd/admission/ গিয়ে এডমিশন সেকশনে সার্চ করুন,RUET
রুয়েটে কোন সাবজেক্টে কত মার্কস এর এক্সাম হবে?,একেক বছর একেক রকম থাকে চেক https://www.admissionwar.com/ এবং সার্চ করুন চুয়েট অথবা চেক করুন http://www.ruet.ac.bd/admission/ গিয়ে এডমিশন সেকশনে সার্চ করুন,RUET
রুয়েটে কি ক্যাল্কুলেটর ইউজ করা যাবে?,চেক https://www.admissionwar.com/ এবং সার্চ করুন চুয়েট অথবা চেক করুন http://www.ruet.ac.bd/admission/ গিয়ে এডমিশন সেকশনে সার্চ করুন,RUET
রুয়েটে কোন মডেলের ক্যাল্কুলেটর ইউজ করা যাবে?,একেক বছর একেক রিকোয়ারমেন্ট লাগে চেক https://www.admissionwar.com/ এবং সার্চ করুন চুয়েট অথবা চেক করুন http://www.ruet.ac.bd/admission/ গিয়ে এডমিশন সেকশনে সার্চ করুন,RUET
রুয়েটে টাইম লিমিট কিরকম?,চেক https://www.admissionwar.com/ এবং সার্চ করুন চুয়েট অথবা চেক করুন http://www.ruet.ac.bd/admission/ গিয়ে এডমিশন সেকশনে সার্চ করুন,RUET
কয়টাতে প্লাস মিস হলে রুয়েটে এক্সাম দেয়া যাবে না?,একেক বছর একেক রিকোয়ারমেন্ট লাগে চেক https://www.admissionwar.com/ এবং সার্চ করুন চুয়েট অথবা চেক করুন http://www.ruet.ac.bd/admission/ গিয়ে এডমিশন সেকশনে সার্চ করুন,RUET
মার্কস ডিস্ট্রিবিউশন কেমন রুয়েটে?,একেক বছর একেক রকম থাকে চেক https://www.admissionwar.com/ এবং সার্চ করুন চুয়েট অথবা চেক করুন http://www.ruet.ac.bd/admission/ গিয়ে এডমিশন সেকশনে সার্চ করুন,RUET
রুয়েটে লিখিত নাকি এমসিকিউ এক্সাম হবে?,সাধারনত লিখিত হয় তারপরেও  চেক https://www.admissionwar.com/ এবং সার্চ করুন চুয়েট অথবা চেক করুন http://www.ruet.ac.bd/admission/ গিয়ে এডমিশন সেকশনে সার্চ করুন,RUET
রুয়েটে কি কোনো ক্যাল্কুলেটর নিয়ে ঝামেলা আছে?,চেক https://www.admissionwar.com/ এবং সার্চ করুন চুয়েট অথবা চেক করুন http://www.ruet.ac.bd/admission/ গিয়ে এডমিশন সেকশনে সার্চ করুন,RUET
রুয়েটে কি হল ইন্সট্রাকটররা হেল্প করে?,হুম অব্যশই করে,RUET
কেউ কি আমাকে রুয়েটে সিলেকশন এর পুরো প্রসেস টা বলতে পারবেন?,চেক https://www.admissionwar.com/ এবং সার্চ করুন চুয়েট অথবা চেক করুন http://www.ruet.ac.bd/admission/ গিয়ে এডমিশন সেকশনে সার্চ করুন,RUET
রুয়েটে কি নতুন সিলেবাস প্রিফার করে?,হুম নতুন সিলেবাস অনুযায়ী এক্সাম হবে,RUET
রুয়েটে এক্সাম কতক্ষন হবে?,চেক https://www.admissionwar.com/ এবং সার্চ করুন চুয়েট অথবা চেক করুন http://www.ruet.ac.bd/admission/ গিয়ে এডমিশন সেকশনে সার্চ করুন,RUET
রুয়েটে কি ওয়েটিং লিস্ট দেয়?,হুম দেয়,RUET
রুয়েটে কি সেকেন্ড টাইমাররা পরীক্ষা দিতে পারবে?,না,RUET