question,answer,university
SUST/সাস্ট এ migration/মাইগ্রেশন কি ভর্তির সময় দেওয়া subject/সাব্জেক্ট/সাবজেক্ট choice/চয়েজ এর সিরিয়াল অনুসারে হয় নাকি অন্য কোন ভাবে ?,মাইগ্রেশন মেইনলি অরিয়েন্টেশন এর পর শুরু হয়। তোমাকে তোমার ডিপ্ট থেকে ফর্ম কালেক্ট করে ফিল আপ করতে হবে। ১০ দিনের মধ্যে রেজাল্ট পেয়ে যাবা। মেইনলি তোমার মাইগ্রেশন হবে তোমার মেরিট পজিশন এবং তোমার চাওয়া ডিপ্ট এর সিট খালি থাকা সাপেক্ষে।একবার মাইগ্রেশন হয়ে গেলে তোমাকে ওই ডিপ্ট এই যেতে হবে তুমি চাইলেও আর তোমার আগের ডিপ্টে থাকতে পারবে না।,SUST
সাস্ট এর এডমিট কার্ড হারিয়ে ফেলেছি।পজিশন দূরে ছিলো বলে গুরুত্ব দেই নি।এখন ২৬ তারিখ যাওয়ার জন্য এসএমএস দিয়েছে। এডমিট কার্ড ছাড়া কি ভর্তি হওয়া যাবেনা?,কোনো সমস্যা হবার কথা না। বাকি সব কাগজপ্ত্র ঠিকমতো নিয়ে গেলেই হবে।,SUST
আমার কাছে সাস্টের এডমিটের applicants copy/অ্যাপ্লিকেন্ট কপি আছে কিন্তু invigilator/ইনভ্যালিটর এর কোন sign/সাইন দেয়া নেই! এতে কি এডমিট হতে কোন প্রব্লেম হবে?,কোনো সমস্যা হবার কথা না। বাকি সব কাগজপ্ত্র ঠিকমতো নিয়ে গেলেই হবে।,SUST
সাস্টে ভর্তির সময় কি কি নিয়ে নেবে?শুধু ট্রান্সক্রিপ্ট?,"ভর্তির জন্য প্রয়োজনীয় জিনিসপত্র-
১. ভর্তি পরীক্ষার সময়কার সিগনেচার করা এডমিট কার্ড।
২. এসএসসি বা সমমান ও এইচএসসি বা সমমান পরীক্ষার মূল মার্কশীট এবং সার্টিফিকেট।
৩. প্রয়োজনীয় টাকা।
৪. কোটায় ভর্তিচ্ছুদের কোটা সম্পর্কিত যথাযথ সনদপত্রের মূল কপি।
৫. প্রতিটি সনদপত্র ও নম্বরপত্রের ২টি সত্যায়িত ফটোকপি।",SUST
সাস্টের ওয়েবসাইট এ বলা আছে এসএসসি ও এইচএসসি এর সার্টিফিকেট আনতে।কিন্তু কলেজে এ তো এখনো সার্টিফিকেট আসেনি ।এখন কি করতে হবে???,"ভর্তির জন্য প্রয়োজনীয় জিনিসপত্র-
১. ভর্তি পরীক্ষার সময়কার সিগনেচার করা এডমিট কার্ড।
২. এসএসসি বা সমমান ও এইচএসসি বা সমমান পরীক্ষার মূল মার্কশীট এবং সার্টিফিকেট।
৩. প্রয়োজনীয় টাকা।
৪. কোটায় ভর্তিচ্ছুদের কোটা সম্পর্কিত যথাযথ সনদপত্রের মূল কপি।
৫. প্রতিটি সনদপত্র ও নম্বরপত্রের ২টি সত্যায়িত ফটোকপি।",SUST
সাস্টে ভর্তির সময় সাথে করে কি কি নিয়ে যেতে হবে?,"ভর্তির জন্য প্রয়োজনীয় জিনিসপত্র-
১. ভর্তি পরীক্ষার সময়কার সিগনেচার করা এডমিট কার্ড।
২. এসএসসি বা সমমান ও এইচএসসি বা সমমান পরীক্ষার মূল মার্কশীট এবং সার্টিফিকেট।
৩. প্রয়োজনীয় টাকা।
৪. কোটায় ভর্তিচ্ছুদের কোটা সম্পর্কিত যথাযথ সনদপত্রের মূল কপি।
৫. প্রতিটি সনদপত্র ও নম্বরপত্রের ২টি সত্যায়িত ফটোকপি।",SUST
সাস্টে মোট কয় কপি ছবি লাগবে ভর্তি হতে?,২ কপি,SUST
সাস্টে ভর্তি হতে কি এস এস সি প্রশংসা পত্র লাগবে?,লাগবে না,SUST
"ডিউ ডি তে পজিশন ৬১৯,,,,সাস্টে সিভিলে ভর্তি হইছে।এইটা কতটুকু ভালো সিদ্ধান্ত?",তোমার প্যাশন যেটাতে ওইটাতে ভর্তি হয়। প্রয়োজনে কারো হেল্প নাও।,SUST
pharmacy/ফার্মাসি   or/বা CSE/সিএসই কোনটা পড়া better/ভাল/ভালো হবে???,তোমার প্যাশন যেটাতে ওইটাতে ভর্তি হয়। প্রয়োজনে কারো হেল্প নাও।,All
সাস্টের Math আর Statistics এর মাঝে কোনটা ভাল??,তোমার প্যাশন যেটাতে ওইটাতে ভর্তি হয়। প্রয়োজনে কারো হেল্প নাও।,SUST
সাস্টে ভর্তি ক্যান্সেল করলে কি টাকা লাগবে? মার্কশিট কি তখনই পেয়ে যাব?,হুম তখনি পেয়ে যাবে সাস্টের রেজিস্টার অফিসে এ ব্যাপারে যোগাযোগ করো,SUST
SUST/সাস্ট এ ভর্তি cancel/বাতিল/ক্যান্সেল করলে সব document/ডকুমেন্ট/কাগজপ্ত্র কি ফেরত দিবে ?মানে cancel করা যায় কিনা ?,হুম যায় সব কাগজপত্র দিয়ে দিবে,SUST
সিলেটে রেলওয়ে স্টেশন থেকে সাস্টে কিভাবে যাওয়া যায়? সাস্টে যাওয়ার ভাড়া কত?,"স্টেশন>আম্বরখানা(২০/- সিএঞ্জি লোকাল ভাড়া)>সাস্ট গেইট(১৫ টাকা সিএঞ্জি লোকাল ভাড়া)। ডিরেক্ট সিএঞ্জি পাইতে পারো। ডিরেক্ট সিএঞ্জি ভাড়া(৩৫-৪০/- টাকা লোকাল)। এছাড়াও, স্টেশন>বন্দর(১০/- লোকাল সিএঞ্জি ভাড়া)> সাস্ট গেইট (১৫ /- লোকাল সিএঞ্জি ভাড়া। সিলেটে পাঠাও + ওভাই এভাইলেবল|",SUST
সিলেটে কি উবার বা পাঠাও এভেইলএবল?,"স্টেশন>আম্বরখানা(২০/- সিএঞ্জি লোকাল ভাড়া)>সাস্ট গেইট(১৫ টাকা সিএঞ্জি লোকাল ভাড়া)। ডিরেক্ট সিএঞ্জি পাইতে পারো। ডিরেক্ট সিএঞ্জি ভাড়া(৩৫-৪০/- টাকা লোকাল)। এছাড়াও, স্টেশন>বন্দর(১০/- লোকাল সিএঞ্জি ভাড়া)> সাস্ট গেইট (১৫ /- লোকাল সিএঞ্জি ভাড়া। সিলেটে পাঠাও + ওভাই এভাইলেবল|",SUST
সাস্টে FFQ/ফ্রিডম ফাইটার কোটা তে কি এবার নাতি-নাতনি নেয়া হয়েছে ?,না শুধু ছেলে/মেয়ে ভর্তি হতে পারবে।,SUST
"সাস্টের এ ইউনিট এর ওয়েটিং কল এর ব্যাপারে ডিটেইলস জানতে চাই,কেও প্লিজ হেল্প করুন",চোখ রাখুন https://www.admissionwar.com/ এবং সার্চ করুন সাস্ট অথবা চেক করুন  http://admission.sust.edu গিয়ে এডমিশন সেকশনে সার্চ করুন,SUST
সাস্টে এইচএসসির মেইন ট্রান্সক্রিপ্ট ছাড়া কি ভর্তি হওয়া যাবে।,সাস্টে ট্রান্সক্রিপ্ট এর মেইন কপি ছাড়া ভর্তি হওয়া যাবে না।,SUST
আমি অমুক জায়গায় ভর্তি আছি। সাস্টে মেইন কপি ট্রান্সক্রিপ্ট ছাড়া ভর্তি হয়ে পরে দুএকদিনের মধ্যে মেইন কপি জমা দিতে পারলে ভর্তি হওয়া যাবে না?,সাস্টে ট্রান্সক্রিপ্ট এর মেইন কপি ছাড়া ভর্তি হওয়া যাবে না।,SUST
সাস্টের সেকেন্ড মেজর সম্পর্কে জানতে চাই।,"সেকেন্ড মেজর হিসেবে চাইলে আপনি ফিজিক্স,ট্রিপলী এবং সিএসই নিতে পারবেন আপনার প্রধান মেজরের পাশাপাশি।তবে তার জন্যে আপনাকে একটি এক্সাম দিতে হবে। সেটি আপনার ভর্তির একবছর পরে শুরু হবে।",SUST
সাস্টে ক্লাস শুরু হবে কখন?,অরিয়েন্টেশন এর পর। মোবাইলে মেসেজ দিয়ে অরিয়েন্টেশনের টাইম জানিয়ে দেয়া হবে অথবা চোখ রাখুন http://admission.sust.edu,SUST
কোন কোন ভার্সিটিতে/বিশ্ববিদ্যালয়ে সেকেন্ড টাইমে দেওয়া যাবে?,"যেসব পাবলিক বিশ্ববিদ্যালয়ে ২য় বার ভর্তি পরীক্ষা দেয়া যাবে:১. জাহাঙ্গীরনগর বিশ্ববিদ্যালয়।(JU),২. শাহজালাল বিজ্ঞান ও প্রযুক্তি বিশ্ববিদ্যালয় (SUST),৩. কুমিল্লা বিশ্ববিদ্যালয়।(COU),৪. খুলনা বিশ্ববিদ্যালয়।(KU),৫. বাংলাদেশ ইউনিভার্সিটি অবপ্রোফেশনালস্। (BUP),৬. ইসলামি বিশ্ববিদ্যালয়।(IU), ৭. বরিশাল বিশ্ববিদ্যালয়, ৯. পটুয়াখালী বিজ্ঞান ও প্রযুক্তি বিশ্ববিদ্যালয়।(PSTU), ১০. বাংলাদেশ কৃষি বিশ্ববিদ্যালয়। (BAU),১১. বেগম রোকেয়া বিশ্ববিদ্যালয়,রংপুর। (BRUR),১২. জাতীয় কবি কাজী নজরুল ইসলাম বিশ্ববিদ্যালয়।(JKKNIU),১৩. ইসলামিক ইউনিভার্সিটি অফসায়েন্সটেকনোলজী (IUT), ১৪. বঙ্গবন্ধু শেখ মুজিবুর রহমানবিজ্ঞান ওপ্রযুক্তি বিশ্ববিদ্যালয়।(BSMRSTU),১৫. মাওলানা ভাসানী বিজ্ঞান ওপ্রযুক্তি বিশ্ববিদ্যালয়(MBSTU),১৬. নোয়াখালী বিজ্ঞান ও প্রযুক্তি বিশ্ববিদ্যালয় (NSTU),১৭. পাবনা বিজ্ঞান ও প্রযুক্তি বিশ্ববিদ্যালয়,১৮. হাজী মোহাম্মাদ দানেশবিজ্ঞান ও প্রযুক্তি বিশ্ববিদ্যালয়।(HSTU),১৯. যশোর বিজ্ঞান ও প্রযুক্তি বিশ্ববিদ্যালয়। (JUST) ২০.Bangabandhu Sheikh Mujibur Rahman Maritime
University ,২১. বঙ্গবন্ধু শেখ মুজিবুর রহমানকৃষি বিশ্ববিদ্যালয়,২২. শেরে বাংলা কৃষি বিশ্ববিদ্যালয়,২৩. সরকারি মেডিকেল কলেজ,২৪. আর্মি মেডিকেল কলেজ।",All
সাস্টের স্পেশাল কোনো বই থাকলে বলবেন?,আসলে মেইন বই ই আসল। মেইন বই এর সবগুলো টপিকের বেসিক ক্লিয়ার করুন তাইলেই এনাফ। আর বিগত বছরের প্রশ্ন সল্ভ করুন।,SUST
সাস্টে ম্যাথ করার জন্যে কি এক্সট্রা পেপার দিবে?,হুম একটা এক্সট্রা পেপার এক্সাম হলে প্রভাইড করা হয়।,SUST
সাস্টে কোন কোন মডেলের ক্যালকুলেটর ব্যবহার/ইউজ করা যায়?,সব মডেলের ক্যাল্কুলেটর ইউজ করা যায় প্রোগ্রামেবল ক্যাল্কুলেটর ছাড়া,SUST
সাস্টে এডমিট কার্ডে গেঞ্জি পরা অবস্থায় ছবি আছে।কোন সমস্যা হবে?,কোনো প্রবলেম হবে না।,SUST
সাস্টের কোন কোন ডিপ্ট/ ডিপার্টমেন্ট /বিভাগ আইবি এপ্রোভড/অ্যাপ্রোভড?,Check this http://www.iebbd.org/page/default.aspx?contentid=117&fbclid=IwAR3ObgJyJb5tCQ1r8q5BeiMKMHIg3pze24DkSHNFbnZ2KFzHGimuBcrzoiI,SUST
সাস্টের অফিসের কন্টাক্ট/যোগাযোগ এর নাম্বার টি দরকার?,ভিজিট http://admission.sust.edu/,SUST
সাস্টে মোট কয়টা হল আছে?,৫ টা,SUST
সাস্টে এ ছেলেদের হল কয়টা আছে?,৩ টা,SUST
সাস্টে এ মেয়েদের হল কয়টা আছে?,২ টা(ক্যাম্পাসের ভিতরে) এছাড়া মেয়েদের জন্যে ক্যাম্পাসের বাহিরে ৪-৫ টির মতো হল আছে যেগুলা আসলে ভার্সিটির আন্ডারে পরিচালিত হয়।,SUST
সাস্টের হল এর থাকা খাওয়ার অবস্থা কেমন?,হলে থাকা খাওয়ার দাম অনেক কম। কিন্তু তেমন উন্নতমানের নয়।,SUST
সাস্টের হলে কি মেয়েরা সবাই সিট পায় শুরুতে?,যারা সিলেটের বাইরে থেকে আসে তারা মোটামুটি সিট পায় কারন মেয়েদের ২ টা(ক্যাম্পাসের ভিতরে) হল এছাড়া মেয়েদের জন্যে ক্যাম্পাসের বাহিরে ৪-৫ টির মতো হল আছে যেগুলা আসলে ভার্সিটির আন্ডারে পরিচালিত হয়।,SUST
সাস্টে খেলাধুলার জন্যে কি কি ব্যবস্থা আছে?,"খেলাধুলার জন্যে ৩ টি মাঠ, একটি জিমনেশিয়াম রয়েছে ।",SUST
সাস্টের অডিটরিয়ামের ধারনক্ষমতা কেমন?,প্রায় ১৫০০ এর মত,SUST
সাস্টে কি কি খেলার মাঠ আছে?,"একটি হ্যান্ডবল গ্রাউন্ড, একটি বাস্কেটবল গ্রাউন্ড এবং একটি সেন্ট্রাল ফিল্ড রয়েছে সাস্টে।",SUST
সাস্টে কি কি খেলা হয়?,"সাস্টে প্রতিবছর ক্রিকেট, ফুটবল, বাস্কেটবল,হ্যান্ডবল টুর্নামেন্ট(ছেলে+মেয়ে) এবং বার্ষিক ক্রীড়া প্রতিযোগিতা হয়।এছাড়া ডিপ্ট ভিত্তিক খেলাধুলা থেকে শুরু করে ইনডোর গেমস সবকিছুই হয়।",SUST
সাস্টে কি কনসার্ট/কন্সার্ট হয়?,"হুম সাস্টে প্রতিবছর ই বেশ কয়েকটা ,দেশের নামিদামি ব্যান্ডের কন্সার্ট/কনসার্ট হয়।",SUST
সাস্টে পহেলা বৈশাখে কি কি হয়?,পহেলা বৈশাখে বিভিন্ন অনুষ্টান এর পাশাপাশি বিভিন্ন ডিপ্ট এর স্টল বসে। সকালে বর্ণাঢ্য র‍্যালি হয়। মেলাও বসে।,SUST
সাস্টে কি ঢাবির মতো টিএসসি টাইপ কিছু আছে?,হুম। তবে সেটা টিএসসির মতো এত বড় নয়। এটার না হল ইউসি(ইউনিভার্সিটি সেন্টার),SUST
সাস্টের আই আই সিটি বিল্ডিং এ কি কি ডিপ্ট/ ডিপার্টমেন্ট আছে?,"ইইই,সিএসই,সফটওয়্যার ইঞ্জিনিয়ারিং",SUST
সাস্টে কয়টা একাডেমিক বিল্ডিং আছে?,"৬ টা(আই আই সিটি,এ,বি,সি,ডি,ই বিল্ডিং)",SUST
সাস্টে কি কি কোটা আছে?,ভিজিট http://admission.sust.edu এবং প্রস্পেকটাস চেক করুন।,SUST
সাস্টে কয়টা কোক্যারিকুলার ক্লাব আছে?,৩০+ হবে।,SUST
সাস্টের কো্ক্যারিকুলার অ্যাক্টিভিটিস কেমন?,"৩০+ এর মতো ক্লাব আছে। এখানে ফোটোগ্রাফি থেকে শুরু করে একেবার ক্যারিয়ার,গান,বাজনা,সাইন্স,আইটি,ভলেন্টিয়ারিং সব টাইপের ক্লাব আছে।",SUST
সাস্টের কয়টা নিজস্ব ব্যান্ড আছে?,২টা,SUST
সাস্টে কি কোনো ইংলিশ স্পিকিং ক্লাব আছে?,হুম আছে ।,SUST
সিলেটে টিউশনির বাজারদর কেমন?,বাংলা মিডিয়াম পড়ালে ৩০০০+ থেকে শুরু করে ৫০০০ পর্যন্ত পাওয়া যায়। আর ইংরেজি মিডিয়াম পড়ালে ৮-১০ হাজার ও পাওয়া যায়। তবে ক্ষেত্রবিশেষে বাড়তেও পারে।,SUST
সিলেটে টিউশনিতে কেমন বেতন/পেমেন্ট দেয়?,বাংলা মিডিয়াম পড়ালে ৩০০০+ থেকে শুরু করে ৫০০০ পর্যন্ত পাওয়া যায়। আর ইংরেজি মিডিয়াম পড়ালে ৮-১০ হাজার ও পাওয়া যায়। তবে ক্ষেত্রবিশেষে বাড়তেও পারে।,SUST
সিলেটে হল এ থাকা বেটার নাকি মেস এ?,হলে থাকতে গেলে কিছুটা পলিটিক্সের সাথে জড়াতে হয় তবে মেসে থাকলে এইসব ঝামেলা পোহাতে হয় না।কিন্তু খরচ কিছুটা বেশি হয় হলের তুলনায়।,SUST
সিলেটে কি মেস এভেইলেবল পাওয়া যায়?,হুম সাস্টের বেশিরভাগ স্টুডেন্ট ই মেস এ থাকে।,SUST
সাস্টের ট্রান্সপোর্ট এর অবস্থা কেমন? সব সময় বাস থাকে?,"সকালে ৭ টা থেকে ১০ টা,দুপুর ১২টা,১টা,বিকাল ৪টা,৫টা,রাত ৮টায় বাস ক্যাম্পাস থেকে ছাড়ে। তবে ছাত্রছাত্রীর তুলনায় বাসের সংখ্যার কিছুটা ঘাটতি রয়েছে।",SUST
সাস্টে কি কোনো আন্ডারগ্র্যাড অলিম্পিয়াড হয়?,"সাস্টে ম্যাথ,ফিজিক্স,কেমিস্টি ছাড়াও আরো কিছু কিছু ডিপার্টমেন্টে আন্ডারগ্র্যাড অলিম্পিয়াড হয়।",SUST
ঢাকা ভার্সিটির/ঢাবি বিবিএ ১ম বর্ষের রেগুলার ক্লাস কখন থেকে হবে কেউ কাইন্ডলি বলতে পারেন?,মোবাইলে মেসেজ যাবে,DU
সাংবাদিক হতে হলে কি subject নিয়ে পড়তে হবে এবং কোন গ্রুপ থেকে কেউ জানলে পুরো details বলবেন প্লিজ।,journalism & mass communication,DU
career option হিসেবে কোন subject টা better হবে??,যেকোনো সাব্জেক্ট ই মোটামুটি ভালো।একেকটার ডিমান্ড একেক রকম,DU
ডিউ/ঢাবি তে ভর্তি হতে কি কি কাগজপত্র লাগবে?,একেক ডিপ্টে ভর্তি হতে একেক কাগজপত্র লাগবে বিস্তারিত এর জন্যে বড় ভাইয়ের হেল্প নাও কিনবা ভিজিট http://admission.eis.du.ac.bd/,DU
কোচিং না করে কি ঢাবি তে ডি/ঘ ইউনিটে চান্স পাওয়া কি সম্ভব?,হুম অব্যশই সম্ভব,DU
ঢাবির কেমিস্ট্রি ডিপার্টমেন্টের ভর্তির বিজ্ঞপতিটা কেও দিতে পারবেন?,ভিজিট http://admission.eis.du.ac.bd/,DU
ঢাবির লেথার ইঞ্জিনিয়ারিং এ ভর্তি হতে কত টাকা লাগবে?,ভিজিট http://admission.eis.du.ac.bd/ এবং চেক নোটিশ,DU
ঢাবির ফিজিক্স ডিপার্টমেন্টে কি ভর্তির নোটিশ দিসে?,ভিজিট http://admission.eis.du.ac.bd/,DU
ঢাবিতে এক্সাম দিতে হলে এইচএসসি এবং এসএসসি মিলে টোটাল কত মার্ক লাগে?,ভিজিট http://admission.eis.du.ac.bd/ এবং চেক নোটিশ,DU
