question,answer,university,language
Bsc nursing xm ditha chai.... atar somporka kaw kicu janla plz help koro....,check https://www.admissionwar.com/%E0%A6%A8%E0%A6%BE%E0%A6%B0%E0%A7%8D%E0%A6%B8%E0%A6%BF%E0%A6%82-%E0%A6%AD%E0%A6%B0%E0%A7%8D%E0%A6%A4%E0%A6%BF-%E0%A6%A4%E0%A6%A5%E0%A7%8D%E0%A6%AF/,medical,Banglish
IMC(BIRDEM) OR Holy family te keu form submitt korechen? Form er shather attachments ki attested I mean shottayito hote hobe??,Na,medical,Banglish
1.Anwar khan modern medical college 2.Delta medical college 3 . National medical college -Konta better hobe?,National, anwer,delta ,medical,Banglish
Private medical college gulote ki online a form puron Korte hobe naki college a giye form joma dite Hobe?,giye joma dite hobe,medical,Banglish
Improve hsc exam dile 2019 year e medical  exam a ki 2nd timer gonno hobo ?SSC pass 2016 .,Improve Dile 1st Timer Count Hoben,medical,Banglish
Rajshahi Medical dental unit e chance paice amar coto bon tar position 352. amader bari Gazipu. Vorti hobar por migration hoye ki Dhaka ashar kono possibility asey?,possibility kom .,medical,Banglish
7600 serial niye kon private dental e pora jabe?,hmm...jabe,medical,Banglish
Dr sirajul islam medical college ta kmn???,valo,medical,Banglish
Improvement dile ki test xm dite hbe?,no,medical,Banglish
Merit list koto thakle chittagong medical ase??,45.11,medical,Banglish
Netrokona theke kar kar kothay 1st migration e clg change hoyce??,Patuakhali Medical,medical,Banglish
Kon kon private a apply korte parbo ? amr serial 6325.,Bangladesh, holy family, national, ibnesina,enam ,medical,Banglish
Private Medical e MBBS/BDS naki government dental( Rangpur Dental) e BDS... konta better hbe?,government to always best...seta ja e hok na kno...non government kokhono government hote parbe na...,medical,Banglish